id,title,26/09/2022,27/09/2022,28/09/2022,29/09/2022,30/09/2022,01/10/2022,02/10/2022,03/10/2022,04/10/2022,05/10/2022,06/10/2022,07/10/2022,08/10/2022,09/10/2022,10/10/2022,11/10/2022,12/10/2022,13/10/2022,14/10/2022,15/10/2022,16/10/2022,17/10/2022,18/10/2022,19/10/2022,20/10/2022,21/10/2022,22/10/2022,23/10/2022,24/10/2022,25/10/2022,26/10/2022,27/10/2022,28/10/2022,29/10/2022,30/10/2022,31/10/2022
9657hs,ダンジョンで潮干狩りを,53200,53616,54014,54568,54850,55238,55614,55904,56276,56640,56978,57252,57724,58202,58586,58954,59232,59638,0,0,0,0,0,0,0,0,0,0,0,0,0,0,0,0,0,0
3751ht,追放された名家の長男。ハズレスキルと馬鹿にされた【毒耐性】スキルで最強へと昇り詰める,112896,114094,115066,116068,117118,118454,119620,120628,121494,122448,123264,124096,124808,125530,126306,126922,127582,128110,0,0,0,0,0,0,0,0,0,0,0,0,0,0,0,0,0,0
7365ht,ダンジョン学園の底辺に転生したけど、なぜか俺には攻略本がある,41138,41936,42698,43320,44004,45180,45850,46420,46754,47066,47364,47618,0,48096,0,0,0,0,0,0,0,0,0,0,0,0,0,0,0,0,0,0,0,0,0,0
1218hu,モブな主人公　〜小説の中のモブだけど問題がある,57198,58232,58912,59744,60470,61216,62044,62682,63262,63922,64442,64996,65454,66074,66696,67458,68326,68914,0,0,0,0,0,0,0,0,0,0,0,0,0,0,0,0,0,0
1100hu,必中のダンジョン探索～必中なので安全圏からペチペチ矢を射ってレベルアップ～,37154,37702,38130,38478,38790,39048,39276,39616,39852,40038,40250,40380,40548,40758,40920,41094,41226,41312,0,0,0,0,0,0,0,0,0,0,0,0,0,0,0,0,0,0
1409hu,やり直し公女の魔導革命〜処刑された令嬢は破滅の家門を立て直す〜遠慮？自重？そんなことより魔導具です！,42556,44510,46228,48176,49706,51178,53000,54362,55688,57908,59616,61326,63264,64968,66680,68462,69804,71054,0,0,0,0,0,0,0,0,0,0,0,0,0,0,0,0,0,0
1726hu,【連載版】有名Ｖtuberの兄だけど、義妹が配信切り忘れたら、なぜか俺が有名になった～陰キャだからと振られた俺が、超人気ブラコン妹の兄として注目され、期待の新人Vとしてデビューするけど今更なんですか？,82624,83290,83984,84684,85330,85816,86442,86842,87452,87784,88204,88496,88696,88936,89180,89524,89770,89958,0,0,0,0,0,0,0,0,0,0,0,0,0,0,0,0,0,0
0231ht,オリビア魔石宝飾店へようこそ～家と店を追い出されたので、王都に店をかまえたら、なぜか元婚約者と義妹の結婚式に出ろと言われました～,115692,116818,117916,119026,119908,120722,121362,121824,122474,122920,123386,123702,124066,124444,124758,125090,125284,125410,0,0,0,0,0,0,0,0,0,0,0,0,0,0,0,0,0,0
0501hr,本物の聖女が現れたのでニセモノのお前はいらないと辺境に追放されました,16932,17568,18300,18778,19224,19586,19960,20250,20544,20956,21326,21618,21812,22014,22302,22556,22820,22948,0,0,0,0,0,0,0,0,0,0,0,0,0,0,0,0,0,0
5865hu,朝起きたら探索者《シーカー》になっていたのでダンジョンに潜ってみる,20868,21666,22366,23026,23592,24032,24742,25242,25748,26314,26900,27420,28074,28750,29372,30020,30560,31046,0,0,0,0,0,0,0,0,0,0,0,0,0,0,0,0,0,0
5949hu,戦場の聖女〜妹の代わりに公爵騎士に嫁ぐことになりましたが、今は幸せです〜,6930,8592,10732,12484,13948,15322,16526,17268,17602,18080,18540,18814,19158,19356,19570,19690,19752,19896,0,0,0,0,0,0,0,0,0,0,0,0,0,0,0,0,0,0
7719hu,私のせいで婚約破棄されたそうでお城を解雇されました。,53230,53876,54492,54854,54984,55050,55150,55206,55224,55268,55328,55338,55366,55452,55480,55516,55546,55560,0,0,0,0,0,0,0,0,0,0,0,0,0,0,0,0,0,0
3141hu,千早ちゃんの評判に深刻なエラー,9254,9796,10548,11274,11812,12306,12800,13104,13490,13754,14030,14240,14542,14764,15002,15226,15474,15604,0,0,0,0,0,0,0,0,0,0,0,0,0,0,0,0,0,0
8845hu,【連載版】天才錬金術師は気ままに旅する～世界最高の元宮廷錬金術師はポーション技術の衰退した未来に目覚め、無自覚に人助けをしていたら、いつの間にか聖女さま扱いされていた件,28836,29398,29896,30310,30662,30994,31340,31682,31862,32112,32320,32462,32618,32730,32870,33056,33186,33270,0,0,0,0,0,0,0,0,0,0,0,0,0,0,0,0,0,0
9567hu,魔界から生還したら婚約者が親友と結婚していた,35556,35994,36306,36688,37074,37402,37792,38000,38180,38252,38290,38332,0,0,0,0,0,0,0,0,0,0,0,0,0,0,0,0,0,0,0,0,0,0,0,0
6895gp,片田舎のおっさん、剣聖になる　～ただの田舎の剣術師範だったのに、大成した弟子たちが俺を放ってくれない件～,270270,271238,272048,273020,273904,274826,276126,277564,278966,280274,281584,282862,283988,285320,286644,287950,289126,290174,0,0,0,0,0,0,0,0,0,0,0,0,0,0,0,0,0,0
9263hu,物語完結後の世界線で「やっぱり君を聖女にする」と神様から告げられた悪役令嬢の華麗なる大逆転劇,35734,37062,38184,39596,40752,41844,43056,44058,44918,45506,46022,46322,46516,46734,46944,47224,47398,47630,0,0,0,0,0,0,0,0,0,0,0,0,0,0,0,0,0,0
7617gy, 転生先が気弱すぎる伯爵夫人だった～前世最強魔女は快適生活を送りたい～,93280,96100,98560,100332,101546,102840,103944,104710,105228,105628,106012,106338,106600,106958,107352,107674,107904,108142,0,0,0,0,0,0,0,0,0,0,0,0,0,0,0,0,0,0
0030hu,婚約者は愛をたくさんお持ちだそうです～いろいろ目が覚めたので、婚約破棄いたします～,36728,37050,37536,37988,38434,38748,39178,39648,40076,40374,40662,40826,41156,41460,41848,42124,42528,42866,0,0,0,0,0,0,0,0,0,0,0,0,0,0,0,0,0,0
1501hv,婚約者が明日、結婚するようです。,55406,56768,58080,59256,60140,61690,63484,65110,66452,67570,68700,69434,70358,71324,72262,72922,73590,74298,0,0,0,0,0,0,0,0,0,0,0,0,0,0,0,0,0,0
3037hv,殿下、婚約破棄は分かりましたが、それより来賓の「皇太子」の横で地味眼鏡のふりをしている本物に気づいてくださいっ！,42474,43464,44640,45768,46770,47704,48532,49162,49788,50504,51030,51474,52008,52496,52972,53392,53722,53928,0,0,0,0,0,0,0,0,0,0,0,0,0,0,0,0,0,0
8239gp,【毎日更新中】恋した人は、妹の代わりに死んでくれと言った。～妹と結婚した片思い相手がなぜ今さら私のもとに？と思ったら～,133648,134298,135446,136872,137600,135186,134488,134126,133942,133774,133600,0,0,0,0,0,0,0,0,0,0,0,0,0,0,0,0,0,0,0,0,0,0,0,0,0
4947hu,死の運命を回避するために、未来の大公様、私と結婚してください！,14512,14792,15030,17944,18718,19020,19314,19578,19752,19890,20020,20144,20266,20384,20538,20682,20854,21304,0,0,0,0,0,0,0,0,0,0,0,0,0,0,0,0,0,0
5377hv,バツ3の看取り夫人と呼ばれていますので捨て置いてくださいませ,49348,50440,51482,52366,53396,54288,55514,56446,57556,58462,59276,59922,60614,61326,62244,63070,63656,64392,0,0,0,0,0,0,0,0,0,0,0,0,0,0,0,0,0,0
6147hv,「弱い王子はいらん」と王家を追放された王子は、最弱スキル【鑑定】の力で最強に至る　〜最弱スキルで有名な【鑑定】ですが、その正体は全てを見通す【神の目】でした〜,12368,14154,15918,17734,19164,20530,21966,23146,24106,25082,25950,26664,27398,28232,29140,29994,30646,31264,0,0,0,0,0,0,0,0,0,0,0,0,0,0,0,0,0,0
5106hv,聖女と結婚するのに婚約者の姉が邪魔！？姉は精霊の愛し子ですよ？,15718,16340,16800,17348,17828,18358,18798,19098,19390,19602,19758,19942,20278,20552,20728,20920,21088,21346,0,0,0,0,0,0,0,0,0,0,0,0,0,0,0,0,0,0
6472hv,【連載版】クビになったVtuberオタ、ライバル事務所の姉の家政夫に転職し気付けばざまぁ完了～人気爆上がりVtuber達に言い寄られてますがそういうのいいので元気にてぇてぇ配信してください～,11088,11768,12292,12602,13040,13644,14062,14398,14690,14840,15010,15144,15266,15384,15486,15570,15632,15770,0,0,0,0,0,0,0,0,0,0,0,0,0,0,0,0,0,0
5806hv,捨てられ伯爵令嬢が突っ走りますわよ！　～婚約破棄＆追放されましたが、「新しい私」として楽しく暮らす所存です(キリリッ！)～,15060,17926,19456,20188,20992,21514,21940,22346,22660,22946,23282,23548,23686,23882,24082,24232,24364,24526,0,0,0,0,0,0,0,0,0,0,0,0,0,0,0,0,0,0
8768hu,異星文明製ガイノイドとして蘇生されましたが、魔法少女に追い掛け回される日々を送っています,10856,12236,13392,14382,15468,16110,16626,17056,17412,17718,18048,18376,18714,19034,19452,19766,20012,20278,0,0,0,0,0,0,0,0,0,0,0,0,0,0,0,0,0,0
5091gj,【完結】完璧すぎて可愛げがないと婚約破棄された聖女は隣国に売られる【9/25コミックス第２巻発売】,168644,169134,169658,170022,170238,170436,170672,170886,171074,171220,171330,0,0,0,0,0,0,0,0,0,0,0,0,0,0,0,0,0,0,0,0,0,0,0,0,0
6740hv,田舎子爵の巻き込まれ婚約破棄とその顛末,29242,29656,30190,30534,30862,31160,31470,31782,32136,32346,32516,32684,32848,33092,33400,33574,33968,34176,0,0,0,0,0,0,0,0,0,0,0,0,0,0,0,0,0,0
8906hp,意地悪な義姉は魔法使いにジョブチェンジしました,6854,7910,8944,9702,10104,10422,10680,10814,10878,10930,11032,0,0,0,0,0,0,0,0,0,0,0,0,0,0,0,0,0,0,0,0,0,0,0,0,0
7111hv,悪女のセリフがスラスラ出てくる,35520,37546,39302,41142,42740,44230,45496,46678,47898,48830,49750,50610,51376,52020,52820,53584,54288,55034,0,0,0,0,0,0,0,0,0,0,0,0,0,0,0,0,0,0
7621hv,【連載版】落ちこぼれ令嬢は、公爵閣下からの溺愛に気付かない〜婚約者に指名されたのは才色兼備の姉ではなく、私でした〜,14082,14666,15418,15782,16154,16418,16718,16970,17328,17568,17832,17972,18134,18344,18582,18712,18874,19044,0,0,0,0,0,0,0,0,0,0,0,0,0,0,0,0,0,0
6788hv,【完結】今日で貴方を忘れます。だからどうぞお幸せに。【なろう版】,23624,24458,24994,25494,25914,26320,26878,27228,27592,28030,28362,28610,28806,29062,29324,29558,29786,30132,0,0,0,0,0,0,0,0,0,0,0,0,0,0,0,0,0,0
7788hv,元カノの姉と付き合っているんだけど、相性抜群で毎日が楽しい　〜元カノを嫉妬させるために付き合ったけど、もう元には戻れなそうです〜,6826,7744,8332,8774,9094,9380,9598,9750,9892,10062,10200,10340,10440,10528,10630,10762,10794,10828,0,0,0,0,0,0,0,0,0,0,0,0,0,0,0,0,0,0
8144hv,合コンに参加した翌日から、学部一の美女と関わり始めることになった,1658,2504,3608,4566,5320,0,0,0,0,0,0,0,0,0,0,0,0,0,0,0,0,0,0,0,0,0,0,0,0,0,0,0,0,0,0,0
3457hu,若隠居のススメ～ペットと家庭菜園で気ままなのんびり生活。の、はず,778,1156,1692,2976,4646,6216,7652,9116,10232,11126,11816,12470,13134,13758,14424,15002,15512,15838,0,0,0,0,0,0,0,0,0,0,0,0,0,0,0,0,0,0
8284hv,【短篇】偽聖女の汚名を着せられ王太子に婚約破棄を言い渡された、虹の聖女は再び求婚される,6278,7572,8374,8796,9052,9164,9304,9378,9452,0,0,0,0,0,0,0,0,0,0,0,0,0,0,0,0,0,0,0,0,0,0,0,0,0,0,0
6993hv,平民聖女の婚約者,18588,23840,27020,28718,29852,30896,31740,32510,33196,33728,34164,34578,35156,35592,36134,36874,37814,38624,0,0,0,0,0,0,0,0,0,0,0,0,0,0,0,0,0,0
8495hv,ここはゴミ捨て場ではありません！　～婚約破棄された悪役令嬢が森にポイ捨てされたので拾いに行ったら、ちょうどそこで勇者パーティーが聖女を追放してポイ捨てしていたので、両方とも綺麗に拾って帰りました～,4404,7736,10922,14914,17762,20142,21942,22900,23310,23732,24030,24316,24576,24886,25156,25418,25640,25792,0,0,0,0,0,0,0,0,0,0,0,0,0,0,0,0,0,0
8584hv,実力主義の学校で彼女に裏切られて全てを失った俺はのんびり高校生生活を謳歌する事にします,4330,5260,5888,6134,6240,6314,6386,6570,6686,6806,6918,6996,7092,7150,7216,7302,7384,7418,0,0,0,0,0,0,0,0,0,0,0,0,0,0,0,0,0,0
8798hv,織田信勝転生〜鑑定スキルで戦国無双　死亡フラグを回避して天下泰平を目指す〜,292,616,1066,1604,2154,2602,3094,3466,3956,4300,4662,5144,5548,5920,6194,6420,6756,7062,0,0,0,0,0,0,0,0,0,0,0,0,0,0,0,0,0,0
2897hv,あなたが私を捨てた夏,4836,5636,6064,6302,6392,6482,6518,6574,0,0,0,0,0,0,0,7690,9404,11244,0,0,0,0,0,0,0,0,0,0,0,0,0,0,0,0,0,0
8473hv,空っぽ聖女でしたが覚醒したので、絶望的だった契約婚も満喫してやります！（でも陛下がお慕いしている大聖女、実は前世の私なので気まずいです）,21552,24484,26992,30048,32258,34364,36414,38904,41946,44676,48140,50554,52722,54940,57202,58966,60584,61842,0,0,0,0,0,0,0,0,0,0,0,0,0,0,0,0,0,0
8687hu,公爵令嬢ガブリエラの戦争と結婚　～婚約破棄されて気狂い王子に嫁がされましたが理想の上司だし、実は私は最強です～,3412,4568,5754,6804,7456,7946,8224,8456,8522,8586,8658,8718,0,0,0,0,0,0,0,0,0,0,0,0,0,0,0,0,0,0,0,0,0,0,0,0
8069hv,勇者に幼馴染が寝取られ絶望したので、闇の炎に抱かれて死のうと思ったら、娘ができていました。,3716,4896,5582,6194,6562,6786,7070,7378,7570,7754,7954,8100,8310,8448,8632,8748,8886,9012,0,0,0,0,0,0,0,0,0,0,0,0,0,0,0,0,0,0
6651hv,私と殿下の結婚エンドは削除されたらしい,7952,9236,9818,10146,10350,10534,10760,10882,10994,11064,11148,11216,11312,11402,11492,11552,11586,11636,0,0,0,0,0,0,0,0,0,0,0,0,0,0,0,0,0,0
8014hv,魔術学園の最強剣士～魔力ゼロの無能と追放されましたが、スキル《何でも切断》を授かりました。伝説の竜王も極限魔法も、すべて剣一本で叩き斬ります。え？　いまだに魔法なんて使ってるんですか？～,1220,1476,1832,2308,2716,3028,3348,3646,3918,4564,4978,5398,5648,5878,6068,6236,6340,6420,0,0,0,0,0,0,0,0,0,0,0,0,0,0,0,0,0,0
8609hv,富豪令嬢～推しは金より尊しですわ～,31084,33840,35836,37552,38834,40322,41668,42878,43808,44648,45424,45986,46708,47360,48240,48850,49492,50334,0,0,0,0,0,0,0,0,0,0,0,0,0,0,0,0,0,0
9246hv,第二王子は要領が悪い　～婚約披露パーティー当日に肝心の婚約者がいなかった結果～,4758,5868,6812,7312,7754,8116,8942,9360,9834,10356,10694,10920,11040,11240,11394,11492,11552,11628,0,0,0,0,0,0,0,0,0,0,0,0,0,0,0,0,0,0
9094hv,間違いだらけの婚約破棄　　～違います殿下　そうではありません～,2432,5270,7842,9022,9458,9694,9882,9964,10064,10130,10200,10210,10230,10228,10246,10262,10320,10384,0,0,0,0,0,0,0,0,0,0,0,0,0,0,0,0,0,0
8822hv,伯爵令嬢は十六回目のお見合いも破談を目指します,3604,4706,5402,5722,5938,6032,6122,6228,6350,0,0,0,0,0,0,0,0,0,0,0,0,0,0,0,0,0,0,0,0,0,0,0,0,0,0,0
9289hv,平民の娘だから婚約者を譲れって？　別にいいですけど本当によろしいのですか？,12580,18344,21648,23310,24360,25066,25778,26378,26934,27374,27860,28156,28456,28778,29174,29368,29750,30080,0,0,0,0,0,0,0,0,0,0,0,0,0,0,0,0,0,0
6986hv,オネェ系公爵子息は宝物を見つけた,2126,2842,3516,4172,4594,4828,4982,5124,5210,5260,0,0,0,0,0,0,0,0,0,0,0,0,0,0,0,0,0,0,0,0,0,0,0,0,0,0
8952hv,【続編】【次世代】私のせいで婚約破棄されたそうでお城を解雇されました。……の娘の話。,6088,8636,9970,10772,11258,11514,11710,11820,11870,11974,12100,12176,12198,12292,12384,12418,12466,12520,0,0,0,0,0,0,0,0,0,0,0,0,0,0,0,0,0,0
9123hv,婚約者様の口ぐせが「俺に逆らうなら婚約破棄だ！」なので望みどおり婚約を解消しました。二度と侮られないよう筋肉を鍛えようと思います。,1382,2186,2988,3528,3746,3836,3892,3916,3920,0,0,0,0,0,0,0,0,0,0,0,0,0,0,0,0,0,0,0,0,0,0,0,0,0,0,0
8970hv,王様から逃れたい私は賢い料理人になりました,292,670,1278,1652,2062,2184,2256,2322,2414,2462,2496,2528,2544,2554,2562,2564,2564,2574,0,0,0,0,0,0,0,0,0,0,0,0,0,0,0,0,0,0
8724hv,巻き戻っても記憶がなくても結局溺愛されることに変わりはないようです,1746,3380,5240,6726,7722,8192,8604,8772,8850,8882,8916,8964,8984,9008,0,0,0,0,0,0,0,0,0,0,0,0,0,0,0,0,0,0,0,0,0,0
9353hv,傷つけられた方は一生忘れないのよ。さようならデール様。,2572,5374,7026,7596,7842,7944,8026,8076,8144,8162,8214,0,0,0,0,0,0,0,0,0,0,0,0,0,0,0,0,0,0,0,0,0,0,0,0,0
9211hv,忘れられた7番姫は結婚して幸せになっています。父王さま、ザマァ展開が近づいてますが、私は何もしておりません。,4276,11462,15434,17218,18022,18506,18786,19156,19440,19598,19748,19840,19876,19992,20110,20218,20274,20372,0,0,0,0,0,0,0,0,0,0,0,0,0,0,0,0,0,0
9198hv,笑顔で人の婚約を破棄させていただけなのに、第一王子に溺愛されました。,1076,1566,1926,2314,2590,2714,2786,2820,0,0,0,0,0,0,0,0,0,0,0,0,0,0,0,0,0,0,0,0,0,0,0,0,0,0,0,0
9534hv,婚約破棄をした王太子の行く道,1616,3388,5296,6402,6990,7178,7350,7398,7482,7510,7598,7650,0,0,0,0,0,0,0,0,0,0,0,0,0,0,0,0,0,0,0,0,0,0,0,0
8984hv,とりまき令嬢デイジーの決断と幸せ,1588,3498,6036,8058,9432,10158,10402,10520,10670,10704,10788,10786,10802,10888,10942,10992,11026,11062,0,0,0,0,0,0,0,0,0,0,0,0,0,0,0,0,0,0
9550hv,【短編】あなたの愛が正しいわ～夫が私の悪口を言っていたので理想の妻になってあげたのに、どうしてそんな顔をするの？～,18526,27090,31680,34346,36510,38244,40132,41776,43224,44404,45226,45732,46498,47204,47956,48514,49132,49654,0,0,0,0,0,0,0,0,0,0,0,0,0,0,0,0,0,0
9553hv,愛することをやめたら、怒る必要もなくなりました。今さら私を愛する振りなんて、していただかなくても大丈夫です。,9840,18052,23640,26972,28850,29874,30698,31310,31912,32418,32756,32912,33222,33718,34120,34504,34888,35736,0,0,0,0,0,0,0,0,0,0,0,0,0,0,0,0,0,0
6469ht,靴（くつ）職人と蔑まれていた男爵令嬢ですが、婚約破棄されて世間体を気にしなくてよくなったので靴作りで実家の借金返済にはげみます！,630,1136,1632,2086,2642,2954,3180,3364,3490,3572,3602,0,0,0,0,0,0,0,0,0,0,0,0,0,0,0,0,0,0,0,0,0,0,0,0,0
8168hv,女子高生に大人気のカフェの通称王子様系イケメン店員の正体がどこにでもいるただの陰キャ男子高校生の俺だってバレたら生きていけない〜あまり目立ちたくないので美少女はお断りさせていただきます〜,112,268,620,1106,2332,3838,5484,7024,8032,8952,9784,10420,10818,11128,11400,11590,11780,12010,0,0,0,0,0,0,0,0,0,0,0,0,0,0,0,0,0,0
0057hw,トリニティー公爵令嬢の災難,336,1248,2376,3134,3606,3728,3774,3826,3850,3902,0,0,0,0,0,0,0,0,0,0,0,0,0,0,0,0,0,0,0,0,0,0,0,0,0,0
9804hv,『武術の神』と呼ばれたじいさん若返る。１０歳の美少年になって無双＆ハーレムの二周目人生を堪能します。一方、じいさんを追放したギルドは没落し、やっぱり追放しなければよかった……と後悔しても、もう遅い。,186,452,930,1766,2618,3224,3676,3838,3918,4012,4122,4212,4314,4462,4630,4740,4884,4968,0,0,0,0,0,0,0,0,0,0,0,0,0,0,0,0,0,0
0194hw,清楚誠実に生きていたら婚約者に裏切られたので、やり直しの世界では悪役令嬢として生きます,442,1842,6190,13688,15902,16724,17050,17236,17410,17558,17708,17780,17878,17936,17984,18034,18070,18108,0,0,0,0,0,0,0,0,0,0,0,0,0,0,0,0,0,0
0003hw,長年想いを寄せてきた幼馴染に振られたら隣の席のダウナー美少女と付き合うことになった件,268,1094,2096,2874,3306,3620,3692,3754,3796,3908,3974,4046,4070,4096,4174,4226,4256,4310,0,0,0,0,0,0,0,0,0,0,0,0,0,0,0,0,0,0
0219hw,【連載版】無自覚な天才付与術師は休み方を知らない　～過労死寸前だった私は隣国の王子様と政略結婚することになりました。好きに休んでいいと言われても……休むってどうするんだっけ？～,2948,7158,9724,10888,11602,12014,12770,13414,14194,14822,15222,15510,15716,15988,16122,16318,16392,16524,0,0,0,0,0,0,0,0,0,0,0,0,0,0,0,0,0,0
0047hw,【連載版】断罪された悪役令嬢を助けたら、宰相閣下に求婚されました,1746,3562,4814,5620,6114,6368,6694,7046,7186,7422,7562,7776,7918,8038,0,0,0,0,0,0,0,0,0,0,0,0,0,0,0,0,0,0,0,0,0,0
9919hv,【連載版】Ｓランク勇者パーティを追放されたネクロマンサー、実は世界最強～急に攻略がうまくいかなくなった？　いや俺がいなくなったらおまえらを強くしてた勇者の守護霊も消えて弱体化すると説明済みなはずだが？,5864,8518,0,0,0,0,0,0,0,0,0,0,0,0,0,0,0,0,0,0,0,0,0,0,0,0,0,0,0,0,0,0,0,0,0,0
4056ft,【コミカライズ】婚約破棄された令嬢は野獣辺境伯へ嫁ぐ！【連載版】,0,46531,47163,47917,48463,49007,49453,49817,50175,50455,50769,51107,51449,51773,52089,52433,52837,53071,0,0,0,0,0,0,0,0,0,0,0,0,0,0,0,0,0,0
2910hr,人生ループ中の公爵令嬢は、自分を殺した婚約者と別れて契約結婚をすることにしました。,0,1646,2594,3960,5674,7376,9338,10674,11554,12220,12738,13108,13396,13620,13874,14034,14210,14318,0,0,0,0,0,0,0,0,0,0,0,0,0,0,0,0,0,0
0546hw,大好きだった幼馴染の妹と結婚する,0,672,3624,5450,6636,7424,8050,8304,8560,8710,8822,8890,8916,8986,9060,9094,9218,9298,0,0,0,0,0,0,0,0,0,0,0,0,0,0,0,0,0,0
6573hv,【短編】幼なじみが自分の事を攻略対象者だと言い出した。,0,734,1790,2602,3158,3424,3616,3664,3686,3706,3750,0,0,0,0,0,0,0,0,0,0,0,0,0,0,0,0,0,0,0,0,0,0,0,0,0
7831hv,とりまき令嬢エレーナの憂鬱と幸せ,0,724,1232,1596,1868,2006,2048,0,0,0,0,0,0,0,0,0,0,0,0,0,0,0,0,0,0,0,0,0,0,0,0,0,0,0,0,0
2424hv,聖女の妹〜貧乏子爵の次女ですがドレス作りで身を立てる予定です！〜,0,576,1158,2098,3104,4212,5558,6252,6598,6842,7034,7178,7234,7274,7350,0,0,0,0,0,0,0,0,0,0,0,0,0,0,0,0,0,0,0,0,0
0515hw,【短編】婚約破棄されたらモテたけど「次は趣味の合う人と結婚します」,0,1308,4978,10432,13288,14756,15320,15674,15906,16134,16272,16322,16422,16536,16588,16668,16772,16854,0,0,0,0,0,0,0,0,0,0,0,0,0,0,0,0,0,0
0131hw,あの日燃えたものは何だったのか,0,792,2404,4926,7374,9236,10152,10410,10610,10686,10760,10804,10834,10904,10926,10932,10974,11022,0,0,0,0,0,0,0,0,0,0,0,0,0,0,0,0,0,0
0916hw,「好きです」と伝え続けた私の３６５日,0,0,2094,14266,23842,28744,31116,32716,33918,35646,36984,38300,39796,41210,42776,44050,45270,46136,0,0,0,0,0,0,0,0,0,0,0,0,0,0,0,0,0,0
1061hw,だいたい地下牢の前で自白する,0,0,58,530,1530,2576,3318,3980,4366,4624,4830,5048,5128,5196,5272,5298,5324,5360,0,0,0,0,0,0,0,0,0,0,0,0,0,0,0,0,0,0
8433hi,怠惰な銀狼と秘密の取引,0,0,3314,3794,4566,5458,6764,7932,8970,10160,11376,12196,13018,13692,14300,14832,15186,15364,0,0,0,0,0,0,0,0,0,0,0,0,0,0,0,0,0,0
0797hw,ヒロインにざまぁしようとしたら逃げ道がないほど追い詰めてしまいとんでもないことになった悪役令嬢,0,0,440,1214,2424,3154,3574,3772,3920,4044,4158,4196,4234,4298,4370,4452,4542,4600,0,0,0,0,0,0,0,0,0,0,0,0,0,0,0,0,0,0
0838hw,婚約解消と言われても仕方がないのではありませんか、お義姉様,0,0,692,1326,1914,2278,2704,2870,2942,2984,3100,3144,3164,3172,3182,3192,3198,3220,0,0,0,0,0,0,0,0,0,0,0,0,0,0,0,0,0,0
0627hw,【短編】生贄として捨てられたので、辺境伯家に自分を売ります　〜いつの間にか聖女と呼ばれ、溺愛されていました〜,0,0,1974,9620,17884,23258,24820,25490,26052,26458,26854,27074,27288,27466,27668,27848,28054,28198,0,0,0,0,0,0,0,0,0,0,0,0,0,0,0,0,0,0
0906hw,【短編】王女フィリアは勇猛だけど奥手な辺境伯を溺愛する,0,0,320,762,1274,1648,1890,2068,2132,2222,2238,0,0,0,0,0,0,0,0,0,0,0,0,0,0,0,0,0,0,0,0,0,0,0,0,0
0783hw,離縁した王女,0,0,1256,2050,2520,2762,2836,2868,2898,2924,2954,2968,2978,3014,3020,3050,3060,3120,0,0,0,0,0,0,0,0,0,0,0,0,0,0,0,0,0,0
1139hw,「ガハハ、一回戦はこんなガキが相手かよ！」といかにもトーナメント一回戦負けしそうな大男、楽勝で闘技大会を優勝し、ついでに負かした連中の手助けまでしてしまう,0,0,0,238,786,1638,2606,3348,4084,4802,5214,5556,5810,6228,6538,6772,7020,7188,0,0,0,0,0,0,0,0,0,0,0,0,0,0,0,0,0,0
6914hv,元婚約者の結婚式で、酔った勢いで嫌われ者の令息と婚約していたことが発覚したのですが……,0,0,0,488,926,1148,1448,0,0,0,0,0,0,0,0,0,0,0,0,0,0,0,0,0,0,0,0,0,0,0,0,0,0,0,0,0
1250hw,すみっこのカナリア　,0,0,0,3132,11432,18000,21654,22912,23530,24022,24358,24770,24936,25222,25466,25616,25808,25982,0,0,0,0,0,0,0,0,0,0,0,0,0,0,0,0,0,0
8317hr,お前は強いからと言われ続けた私ですが、この度弱くなれる旦那様と出逢いました,0,0,0,532,988,1472,2040,2356,2586,2716,2766,2798,2838,0,0,0,0,0,0,0,0,0,0,0,0,0,0,0,0,0,0,0,0,0,0,0
6181hv,【書籍化決定】白い結婚、最高です。,0,0,0,1710,4524,9892,13734,17214,18902,20276,21210,21870,22506,23084,23752,24270,24724,25120,0,0,0,0,0,0,0,0,0,0,0,0,0,0,0,0,0,0
1153hw,「君を愛することはない」と言っていたくせに、今更愛を囁かれても困ります。,0,0,0,582,2144,4312,6114,6952,7384,7546,7748,7892,7928,8010,8090,8172,8196,0,0,0,0,0,0,0,0,0,0,0,0,0,0,0,0,0,0,0
1361hw,【連載版】清楚誠実に生きていたら婚約者に裏切られたので、やり直しの世界では悪役令嬢として生きます,0,0,0,522,1634,2166,2494,2642,2752,2844,2934,3042,0,0,0,0,0,0,0,0,0,0,0,0,0,0,0,0,0,0,0,0,0,0,0,0
0603hw,【完結】婚約破棄と初恋と,0,0,0,720,1422,2084,2516,2642,2696,2734,2752,2788,0,0,0,0,0,0,0,0,0,0,0,0,0,0,0,0,0,0,0,0,0,0,0,0
